{
  "workpack_id": "workpack-manager-v3-pixel-office-ui",
  "overall_status": "complete",
  "last_updated": "2026-03-12T15:30:00Z",
  "prompt_status": {
    "A0_bootstrap": {
      "status": "complete"
    },
    "A1_pixel_room_shell": {
      "status": "complete",
      "assigned_agent": "codex",
      "started_at": "2026-03-12T10:43:56Z",
      "completed_at": "2026-03-12T10:57:40Z"
    },
    "A2_agent_animation_runtime": {
      "status": "complete",
      "assigned_agent": "codex",
      "started_at": "2026-03-12T11:13:00Z",
      "completed_at": "2026-03-12T11:39:31.9953103Z"
    },
    "A3_desk_interactions_chat_preview": {
      "status": "complete",
      "assigned_agent": "codex",
      "started_at": "2026-03-12T11:47:53.2882182Z",
      "completed_at": "2026-03-12T11:47:53.2882182Z"
    },
    "A4_git_diff_side_panel": {
      "status": "complete",
      "assigned_agent": "codex",
      "started_at": "2026-03-12T12:00:00Z",
      "completed_at": "2026-03-12T12:15:00Z"
    },
    "A5_visual_polish_and_motion": {
      "status": "complete",
      "assigned_agent": "codex",
      "started_at": "2026-03-12T13:30:00Z",
      "completed_at": "2026-03-12T14:00:00Z"
    },
    "V1_integration_meta": {
      "status": "complete",
      "assigned_agent": "claude-opus-4-6",
      "started_at": "2026-03-12T14:30:00Z",
      "completed_at": "2026-03-12T15:00:00Z"
    },
    "R1_retrospective": {
      "status": "complete",
      "assigned_agent": "claude-opus-4-6",
      "started_at": "2026-03-12T15:00:00Z",
      "completed_at": "2026-03-12T15:30:00Z"
    }
  },
  "agent_assignments": {},
  "blocked_by": [],
  "execution_log": [
    {
      "timestamp": "2026-03-10T00:00:00Z",
      "event": "created",
      "prompt_stem": null,
      "agent": null,
      "notes": "Workpack scaffold created for the 0.0.3 pixel office UI initiative"
    },
    {
      "timestamp": "2026-03-12T09:51:09Z",
      "event": "prompt_completed",
      "prompt_stem": "A0_bootstrap",
      "agent": null,
      "notes": "Bootstrap completed: pixel-office scene contracts, message protocol, host decision, data flow, and test strategy documented."
    },
    {
      "timestamp": "2026-03-12T10:43:56Z",
      "event": "prompt_started",
      "prompt_stem": "A1_pixel_room_shell",
      "agent": "codex",
      "notes": "Started implementing the pixel room shell, scene mapping, and panel integration."
    },
    {
      "timestamp": "2026-03-12T10:57:40Z",
      "event": "prompt_completed",
      "prompt_stem": "A1_pixel_room_shell",
      "agent": "codex",
      "notes": "Completed the pixel room shell with layout helpers, pixel-art rendering, command wiring, and scene tests."
    },
    {
      "timestamp": "2026-03-12T11:13:00Z",
      "event": "prompt_started",
      "prompt_stem": "A2_agent_animation_runtime",
      "agent": "codex",
      "notes": "Started wiring runtime-driven avatars, motion choreography, and reduced-motion handling into the pixel room."
    },
    {
      "timestamp": "2026-03-12T11:39:31.9953103Z",
      "event": "prompt_completed",
      "prompt_stem": "A2_agent_animation_runtime",
      "agent": "codex",
      "notes": "Completed avatar runtime mapping, host-to-webview transition messages, reduced-motion fallback, and regression coverage."
    },
    {
      "timestamp": "2026-03-12T11:47:53.2882182Z",
      "event": "prompt_started",
      "prompt_stem": "A3_desk_interactions_chat_preview",
      "agent": "codex",
      "notes": "Started wiring desk action menus, prompt command dispatch, hover previews, and room accessibility."
    },
    {
      "timestamp": "2026-03-12T11:47:53.2882182Z",
      "event": "prompt_completed",
      "prompt_stem": "A3_desk_interactions_chat_preview",
      "agent": "codex",
      "notes": "Completed desk interaction menus, host command dispatch, hover chat previews, keyboard accessibility, and regression coverage."
    },
    {
      "timestamp": "2026-03-12T12:00:00Z",
      "event": "prompt_started",
      "prompt_stem": "A4_git_diff_side_panel",
      "agent": "codex",
      "notes": "Started implementing Git diff tree view side panel."
    },
    {
      "timestamp": "2026-03-12T12:15:00Z",
      "event": "prompt_completed",
      "prompt_stem": "A4_git_diff_side_panel",
      "agent": "codex",
      "notes": "Completed Git diff side panel with tree view, repo grouping, and diff stats."
    },
    {
      "timestamp": "2026-03-12T13:30:00Z",
      "event": "prompt_started",
      "prompt_stem": "A5_visual_polish_and_motion",
      "agent": "codex",
      "notes": "Started visual polish, motion refinement, and reduced-motion accessibility."
    },
    {
      "timestamp": "2026-03-12T14:00:00Z",
      "event": "prompt_completed",
      "prompt_stem": "A5_visual_polish_and_motion",
      "agent": "codex",
      "notes": "Completed visual polish: refined palette, easing, reduced-motion fallback, theme tokens."
    },
    {
      "timestamp": "2026-03-12T14:30:00Z",
      "event": "prompt_started",
      "prompt_stem": "V1_integration_meta",
      "agent": "claude-opus-4-6",
      "notes": "Started integration gate. Iteration 1 found 3 bookkeeping blockers (stale SHAs, A5 schema violation, state lag)."
    },
    {
      "timestamp": "2026-03-12T15:00:00Z",
      "event": "prompt_completed",
      "prompt_stem": "V1_integration_meta",
      "agent": "claude-opus-4-6",
      "notes": "V1 passed on iteration 2 after fixing all 3 bookkeeping blockers. All 9 ACs verified, schema valid, DAG acyclic."
    },
    {
      "timestamp": "2026-03-12T15:00:00Z",
      "event": "prompt_started",
      "prompt_stem": "R1_retrospective",
      "agent": "claude-opus-4-6",
      "notes": "Started retrospective: gathering metrics, analyzing execution, documenting lessons."
    },
    {
      "timestamp": "2026-03-12T15:30:00Z",
      "event": "prompt_completed",
      "prompt_stem": "R1_retrospective",
      "agent": "claude-opus-4-6",
      "notes": "Retrospective complete. 8 prompts executed, 0 B-series, 7 action items documented. Workpack complete."
    }
  ],
  "notes": null
}
