{
  "workpack_id": "03_workpack-protocol_agent-documentation",
  "overall_status": "in_progress",
  "last_updated": "2026-02-24T18:30:00Z",
  "prompt_status": {
    "A0_bootstrap": {
      "status": "complete",
      "assigned_agent": "codex",
      "started_at": "2026-02-24T15:30:00Z",
      "completed_at": "2026-02-24T15:35:00Z",
      "output_validated": true
    },
    "A1_agent_rules": {
      "status": "complete",
      "assigned_agent": "claude-opus-4-20250514",
      "started_at": "2026-02-24T18:15:00Z",
      "completed_at": "2026-02-24T18:30:00Z",
      "output_validated": true
    },
    "A2_agent_state_machine": {
      "status": "complete",
      "assigned_agent": "codex",
      "started_at": "2026-02-24T15:50:00Z",
      "completed_at": "2026-02-24T16:00:15Z",
      "output_validated": true
    },
    "A3_agent_context_tool": {
      "status": "complete",
      "assigned_agent": "codex",
      "started_at": "2026-02-24T16:05:00Z",
      "completed_at": "2026-02-24T16:12:00Z",
      "output_validated": true
    },
    "V1_integration_meta": {
      "status": "complete",
      "assigned_agent": "claude-opus-4-20250514",
      "started_at": "2026-02-24T17:30:00Z",
      "completed_at": "2026-02-24T18:00:00Z",
      "output_validated": true
    },
    "R1_retrospective": {
      "status": "pending"
    }
  },
  "agent_assignments": {
    "A0_bootstrap": "codex",
    "A2_agent_state_machine": "codex",
    "A3_agent_context_tool": "codex",
    "A1_agent_rules": "claude-opus-4-20250514",
    "V1_integration_meta": "claude-opus-4-20250514"
  },
  "blocked_by": [],
  "execution_log": [
    {
      "timestamp": "2026-02-23T22:29:24Z",
      "event": "created",
      "prompt_stem": null,
      "agent": null,
      "notes": "Workpack scaffold created"
    },
    {
      "timestamp": "2026-02-24T15:30:00Z",
      "event": "started",
      "prompt_stem": null,
      "agent": "codex",
      "notes": "Execution started"
    },
    {
      "timestamp": "2026-02-24T15:30:10Z",
      "event": "prompt_started",
      "prompt_stem": "A0_bootstrap",
      "agent": "codex",
      "notes": "A0 bootstrap started"
    },
    {
      "timestamp": "2026-02-24T15:35:00Z",
      "event": "prompt_completed",
      "prompt_stem": "A0_bootstrap",
      "agent": "codex",
      "notes": "A0 bootstrap completed"
    },
    {
      "timestamp": "2026-02-24T15:50:00Z",
      "event": "prompt_started",
      "prompt_stem": "A2_agent_state_machine",
      "agent": "codex",
      "notes": "A2 agent state machine documentation started"
    },
    {
      "timestamp": "2026-02-24T16:00:15Z",
      "event": "prompt_completed",
      "prompt_stem": "A2_agent_state_machine",
      "agent": "codex",
      "notes": "A2 agent state machine documentation completed"
    },
    {
      "timestamp": "2026-02-24T16:05:00Z",
      "event": "prompt_started",
      "prompt_stem": "A3_agent_context_tool",
      "agent": "codex",
      "notes": "A3 agent context tool implementation started"
    },
    {
      "timestamp": "2026-02-24T16:12:00Z",
      "event": "prompt_completed",
      "prompt_stem": "A3_agent_context_tool",
      "agent": "codex",
      "notes": "A3 agent context tool implementation completed"
    },
    {
      "timestamp": "2026-02-24T17:30:00Z",
      "event": "prompt_started",
      "prompt_stem": "V1_integration_meta",
      "agent": "claude-opus-4-20250514",
      "notes": "V1 integration gate started"
    },
    {
      "timestamp": "2026-02-24T18:15:00Z",
      "event": "prompt_started",
      "prompt_stem": "A1_agent_rules",
      "agent": "claude-opus-4-20250514",
      "notes": "A1 agent rules formal execution — verified existing AGENT_RULES.md content against AC1-AC3"
    },
    {
      "timestamp": "2026-02-24T18:30:00Z",
      "event": "prompt_completed",
      "prompt_stem": "A1_agent_rules",
      "agent": "claude-opus-4-20250514",
      "notes": "A1 complete: AGENT_RULES.md verified (86 lines, §1-§6 covering all protocol invariants)"
    },
    {
      "timestamp": "2026-02-24T18:00:00Z",
      "event": "prompt_completed",
      "prompt_stem": "V1_integration_meta",
      "agent": "claude-opus-4-20250514",
      "notes": "V1 integration gate completed: FAIL — not merge-ready. 4 blocking issues: uncommitted files, misattributed A2 SHA, placeholder A3 SHA, A1 DAG violation."
    }
  ],
  "notes": null
}
