{
  "workpack_id": "02_workpack-protocol_verification-hardening",
  "overall_status": "complete",
  "last_updated": "2026-02-25T00:55:00Z",
  "prompt_status": {
    "A0_bootstrap": {
      "status": "complete",
      "assigned_agent": "codex",
      "started_at": "2026-02-23T22:30:00Z",
      "completed_at": "2026-02-23T22:50:00Z",
      "output_validated": true
    },
    "A1_state_transition_checks": {
      "status": "complete",
      "assigned_agent": "claude-opus-4",
      "started_at": "2026-02-25T00:30:00Z",
      "completed_at": "2026-02-25T00:35:00Z",
      "output_validated": true
    },
    "A2_markdown_json_sync": {
      "status": "complete",
      "assigned_agent": "codex",
      "started_at": "2026-02-24T22:30:00Z",
      "completed_at": "2026-02-24T23:10:00Z",
      "output_validated": true
    },
    "A3_output_artifact_checks": {
      "status": "complete",
      "assigned_agent": "claude-opus-4",
      "started_at": "2026-02-25T00:35:00Z",
      "completed_at": "2026-02-25T00:40:00Z",
      "output_validated": true
    },
    "A4_commit_verification_tool": {
      "status": "complete",
      "assigned_agent": "codex",
      "started_at": "2026-02-24T23:50:00Z",
      "completed_at": "2026-02-24T23:59:00Z",
      "output_validated": true
    },
    "A5_prompt_style_lint": {
      "status": "complete",
      "assigned_agent": "codex",
      "started_at": "2026-02-24T23:20:00Z",
      "completed_at": "2026-02-24T23:45:00Z",
      "output_validated": true
    },
    "A6_git_hooks_ci_templates": {
      "status": "complete",
      "assigned_agent": "codex",
      "started_at": "2026-02-24T23:59:10Z",
      "completed_at": "2026-02-24T23:59:20Z",
      "output_validated": true
    },
    "A7_unified_verify_command": {
      "status": "complete",
      "assigned_agent": "codex",
      "started_at": "2026-02-24T23:59:50Z",
      "completed_at": "2026-02-24T23:59:59Z",
      "output_validated": true
    },
    "V1_integration_meta": {
      "status": "complete",
      "assigned_agent": "claude-opus-4",
      "started_at": "2026-02-24T23:59:59Z",
      "completed_at": "2026-02-25T00:30:00Z",
      "output_validated": true
    },
    "R1_retrospective": {
      "status": "complete",
      "assigned_agent": "codex",
      "started_at": "2026-02-25T00:45:00Z",
      "completed_at": "2026-02-25T00:55:00Z",
      "output_validated": true
    }
  },
  "agent_assignments": {
    "A0_bootstrap": "codex",
    "A2_markdown_json_sync": "codex",
    "A4_commit_verification_tool": "codex",
    "A5_prompt_style_lint": "codex",
    "A6_git_hooks_ci_templates": "codex",
    "A7_unified_verify_command": "codex",
    "A1_state_transition_checks": "claude-opus-4",
    "A3_output_artifact_checks": "claude-opus-4",
    "V1_integration_meta": "claude-opus-4",
    "R1_retrospective": "codex"
  },
  "blocked_by": [],
  "execution_log": [
    {
      "timestamp": "2026-02-23T22:29:08Z",
      "event": "created",
      "prompt_stem": null,
      "agent": null,
      "notes": "Workpack scaffold created"
    },
    {
      "timestamp": "2026-02-23T22:30:00Z",
      "event": "started",
      "prompt_stem": null,
      "agent": "codex",
      "notes": "Execution started"
    },
    {
      "timestamp": "2026-02-23T22:30:10Z",
      "event": "prompt_started",
      "prompt_stem": "A0_bootstrap",
      "agent": "codex",
      "notes": "A0 bootstrap started"
    },
    {
      "timestamp": "2026-02-23T22:50:00Z",
      "event": "prompt_completed",
      "prompt_stem": "A0_bootstrap",
      "agent": "codex",
      "notes": "A0 bootstrap completed"
    },
    {
      "timestamp": "2026-02-24T22:30:00Z",
      "event": "prompt_started",
      "prompt_stem": "A2_markdown_json_sync",
      "agent": "codex",
      "notes": "A2 markdown-json sync started"
    },
    {
      "timestamp": "2026-02-24T23:10:00Z",
      "event": "prompt_completed",
      "prompt_stem": "A2_markdown_json_sync",
      "agent": "codex",
      "notes": "A2 markdown-json sync completed"
    },
    {
      "timestamp": "2026-02-24T23:20:00Z",
      "event": "prompt_started",
      "prompt_stem": "A5_prompt_style_lint",
      "agent": "codex",
      "notes": "A5 prompt style lint started"
    },
    {
      "timestamp": "2026-02-24T23:45:00Z",
      "event": "prompt_completed",
      "prompt_stem": "A5_prompt_style_lint",
      "agent": "codex",
      "notes": "A5 prompt style lint completed"
    },
    {
      "timestamp": "2026-02-24T23:50:00Z",
      "event": "prompt_started",
      "prompt_stem": "A4_commit_verification_tool",
      "agent": "codex",
      "notes": "A4 commit verification tool started"
    },
    {
      "timestamp": "2026-02-24T23:59:00Z",
      "event": "prompt_completed",
      "prompt_stem": "A4_commit_verification_tool",
      "agent": "codex",
      "notes": "A4 commit verification tool completed"
    },
    {
      "timestamp": "2026-02-24T23:59:10Z",
      "event": "prompt_started",
      "prompt_stem": "A6_git_hooks_ci_templates",
      "agent": "codex",
      "notes": "A6 git hooks and CI templates started"
    },
    {
      "timestamp": "2026-02-24T23:59:20Z",
      "event": "prompt_completed",
      "prompt_stem": "A6_git_hooks_ci_templates",
      "agent": "codex",
      "notes": "A6 git hooks and CI templates completed"
    },
    {
      "timestamp": "2026-02-24T23:59:50Z",
      "event": "prompt_started",
      "prompt_stem": "A7_unified_verify_command",
      "agent": "codex",
      "notes": "A7 unified verify command started"
    },
    {
      "timestamp": "2026-02-24T23:59:59Z",
      "event": "prompt_completed",
      "prompt_stem": "A7_unified_verify_command",
      "agent": "codex",
      "notes": "A7 unified verify command completed"
    },
    {
      "timestamp": "2026-02-24T23:59:59Z",
      "event": "prompt_started",
      "prompt_stem": "V1_integration_meta",
      "agent": "claude-opus-4",
      "notes": "V1 integration gate started"
    },
    {
      "timestamp": "2026-02-25T00:30:00Z",
      "event": "prompt_completed",
      "prompt_stem": "V1_integration_meta",
      "agent": "claude-opus-4",
      "notes": "V1 integration gate completed — FAIL, not merge-ready"
    },
    {
      "timestamp": "2026-02-25T00:30:00Z",
      "event": "prompt_started",
      "prompt_stem": "A1_state_transition_checks",
      "agent": "claude-opus-4",
      "notes": "A1 backfill during V1 remediation"
    },
    {
      "timestamp": "2026-02-25T00:35:00Z",
      "event": "prompt_completed",
      "prompt_stem": "A1_state_transition_checks",
      "agent": "claude-opus-4",
      "notes": "A1 output backfilled — tool existed, tests pass"
    },
    {
      "timestamp": "2026-02-25T00:35:00Z",
      "event": "prompt_started",
      "prompt_stem": "A3_output_artifact_checks",
      "agent": "claude-opus-4",
      "notes": "A3 backfill during V1 remediation"
    },
    {
      "timestamp": "2026-02-25T00:40:00Z",
      "event": "prompt_completed",
      "prompt_stem": "A3_output_artifact_checks",
      "agent": "claude-opus-4",
      "notes": "A3 output backfilled — tool existed, tests pass"
    },
    {
      "timestamp": "2026-02-25T00:45:00Z",
      "event": "prompt_started",
      "prompt_stem": "R1_retrospective",
      "agent": "codex",
      "notes": "R1 retrospective started. Capturing outcomes, friction, rework, and follow-up actions."
    },
    {
      "timestamp": "2026-02-25T00:55:00Z",
      "event": "prompt_completed",
      "prompt_stem": "R1_retrospective",
      "agent": "codex",
      "notes": "Retrospective completed. Documented required six sections, metrics, and action items with owners."
    }
  ],
  "notes": null
}
