{
  "workpack_id": "valid-v6",
  "overall_status": "in_progress",
  "last_updated": "2026-02-26T10:00:00Z",
  "prompt_status": {
    "A0_bootstrap": {
      "status": "complete",
      "assigned_agent": "codex",
      "started_at": "2026-02-26T09:00:00Z",
      "completed_at": "2026-02-26T09:10:00Z",
      "output_validated": true
    },
    "A1_test_strategy": {
      "status": "in_progress",
      "assigned_agent": "copilot",
      "started_at": "2026-02-26T09:15:00Z",
      "completed_at": null
    }
  },
  "agent_assignments": {
    "A1_test_strategy": "copilot"
  },
  "blocked_by": [],
  "execution_log": [
    {
      "timestamp": "2026-02-26T09:00:00Z",
      "event": "started",
      "prompt_stem": null,
      "agent": "codex",
      "notes": "Fixture execution started"
    }
  ],
  "notes": null
}
