{
  "workpack_id": "2026-02-23_feature_workpack-protocol-v6",
  "overall_status": "not_started",
  "last_updated": "2026-02-23T00:00:00Z",
  "prompt_status": {
    "A0_bootstrap": { "status": "pending" },
    "A1_protocol_spec": { "status": "pending" },
    "A2_schemas_and_templates": { "status": "pending" },
    "A3_tooling_linter": { "status": "pending" },
    "A4_tooling_scaffold": { "status": "pending" },
    "A6_adoption_guide": { "status": "pending" },
    "A5_integration_meta": { "status": "pending" },
    "R1_retrospective": { "status": "pending" }
  },
  "agent_assignments": {},
  "blocked_by": [],
  "execution_log": [
    {
      "timestamp": "2026-02-23T00:00:00Z",
      "event": "created",
      "prompt_stem": null,
      "agent": null,
      "notes": "Workpack scaffolded"
    }
  ],
  "notes": null
}
