{
  "workpack_id": "03_workpack-manager_agent-integration",
  "overall_status": "complete",
  "last_updated": "2026-02-26T16:30:00Z",
  "prompt_status": {
    "A0_bootstrap": { "status": "complete", "completed_at": "2026-02-26T15:29:11Z" },
    "A1_provider_interface": { "status": "complete", "completed_at": "2026-02-26T15:29:46Z" },
    "A2_copilot_provider": { "status": "complete", "completed_at": "2026-02-26T16:04:19Z" },
    "A3_codex_provider": { "status": "complete", "completed_at": "2026-02-26T16:04:33Z" },
    "A4_assignment_orchestrator": { "status": "complete", "completed_at": "2026-02-26T16:14:57Z" },
    "A5_integration_meta": { "status": "complete", "completed_at": "2026-02-26T16:15:00Z" },
    "R1_retrospective": { "status": "complete", "completed_at": "2026-02-26T16:30:00Z" }
  },
  "agent_assignments": {
    "A0_bootstrap": "copilot/claude-opus-4-6",
    "A1_provider_interface": "copilot/claude-opus-4-6",
    "A2_copilot_provider": "copilot/claude-opus-4-6",
    "A3_codex_provider": "copilot/claude-opus-4-6",
    "A4_assignment_orchestrator": "copilot/claude-opus-4-6",
    "A5_integration_meta": "copilot/claude-opus-4-6",
    "R1_retrospective": "copilot/claude-opus-4-6"
  },
  "blocked_by": [],
  "execution_log": [
    { "timestamp": "2026-02-23T00:00:00Z", "event": "created", "prompt_stem": null, "agent": null, "notes": "Blocked by extension-core-architecture." },
    { "timestamp": "2026-02-26T15:29:00Z", "event": "started", "prompt_stem": null, "agent": null, "notes": "Implementation session started." },
    { "timestamp": "2026-02-26T15:29:11Z", "event": "prompt_completed", "prompt_stem": "A0_bootstrap", "agent": "copilot/claude-opus-4-6", "notes": "Branch created, scaffold committed." },
    { "timestamp": "2026-02-26T15:29:46Z", "event": "prompt_completed", "prompt_stem": "A1_provider_interface", "agent": "copilot/claude-opus-4-6", "notes": "AgentProvider interface, capability model, registry implemented with tests." },
    { "timestamp": "2026-02-26T16:03:59Z", "event": "prompt_completed", "prompt_stem": "A4_assignment_orchestrator", "agent": "copilot/claude-opus-4-6", "notes": "Assignment model and DAG-aware orchestrator with tests." },
    { "timestamp": "2026-02-26T16:04:19Z", "event": "prompt_completed", "prompt_stem": "A2_copilot_provider", "agent": "copilot/claude-opus-4-6", "notes": "CopilotProvider with vscode.lm API and tests." },
    { "timestamp": "2026-02-26T16:04:33Z", "event": "prompt_completed", "prompt_stem": "A3_codex_provider", "agent": "copilot/claude-opus-4-6", "notes": "CodexProvider with configurable endpoint, SecretStorage auth, and tests." },
    { "timestamp": "2026-02-26T16:14:57Z", "event": "prompt_completed", "prompt_stem": "A4_assignment_orchestrator", "agent": "copilot/claude-opus-4-6", "notes": "Bug fix: temp file collisions in atomic state writes (6b5c4b5)." },
    { "timestamp": "2026-02-26T16:15:00Z", "event": "prompt_completed", "prompt_stem": "A5_integration_meta", "agent": "copilot/claude-opus-4-6", "notes": "V1 verification gate: 9/9 AC verified, tsc clean, 29/29 tests pass." },
    { "timestamp": "2026-02-26T16:30:00Z", "event": "prompt_completed", "prompt_stem": "R1_retrospective", "agent": "copilot/claude-opus-4-6", "notes": "Retrospective completed with 5 action items." },
    { "timestamp": "2026-02-26T16:30:00Z", "event": "completed", "prompt_stem": null, "agent": null, "notes": "All 7 prompts complete. Workpack closed." }
  ],
  "notes": "All 7 prompts complete. 9/9 AC verified. 3,526 lines added across 22 files. One bug fix for temp file collisions."
}
